<?xml version="1.0" encoding="ISO-8859-1"?>
<vehiculos xmlns:xsi="http://www.w3.org/2001/XMLSchema-instance" xsi:noNamespaceSchemaLocation="./vehiculo_1.xsd">
  <vehiculo>
    <nombre>Count Zero</nombre>
    <modelo>Series, I, 80''</modelo>
    <fabricacion>
      <inicio>
        <dia>21</dia>
        <mes>July</mes>
        <anyo>1949</anyo>
      </inicio>
      <fin>
        <dia>21</dia>
        <mes>July</mes>
        <anyo>1949</anyo>
      </fin>
    </fabricacion>
    <modificaciones>
      <modificacion>Change Engine</modificacion>
      <modificacion>Change Engine</modificacion>
      <modificacion>Change Engine</modificacion>
      <modificacion>Change Engine</modificacion>
      <modificacion>Change Engine</modificacion>
    </modificaciones>
  </vehiculo>
</vehiculos>